{
  "$schema": "http://json-schema.org/draft-07/schema#",
  "title": "Governed State Proposal",
  "description": "A proposal for a material change to governed state in this instance.",
  "type": "object",
  "required": [
    "id",
    "created_at",
    "status",
    "change_type",
    "target_surface",
    "summary",
    "rationale",
    "proposer"
  ],
  "additionalProperties": false,
  "properties": {
    "id": {
      "type": "string",
      "description": "Unique identifier. Use format: prop-YYYYMMDD-NNN",
      "pattern": "^prop-[0-9]{8}-[0-9]{3,}$"
    },
    "created_at": {
      "type": "string",
      "format": "date-time",
      "description": "ISO 8601 timestamp when the proposal was created."
    },
    "status": {
      "type": "string",
      "enum": ["proposed", "under_review", "approved", "rejected", "deferred", "superseded"],
      "description": "Current lifecycle status."
    },
    "change_type": {
      "type": "string",
      "enum": ["add", "update", "remove", "restructure", "policy"],
      "description": "The nature of the proposed change."
    },
    "target_surface": {
      "type": "string",
      "description": "The governed-state file or directory being changed. Use a repo-relative path."
    },
    "summary": {
      "type": "string",
      "maxLength": 200,
      "description": "One or two sentence summary of the proposed change."
    },
    "rationale": {
      "type": "string",
      "description": "Why this change should be made. What problem does it solve?"
    },
    "evidence_refs": {
      "type": "array",
      "items": { "type": "string" },
      "description": "References to supporting evidence (file paths, URLs, Supabase thought IDs)."
    },
    "proposed_diff_summary": {
      "type": "string",
      "description": "Human-readable description of what would change."
    },
    "confidence": {
      "type": "number",
      "minimum": 0,
      "maximum": 1,
      "description": "Proposer's confidence that this change is correct (0.0–1.0)."
    },
    "proposer": {
      "type": "string",
      "description": "Who or what created this proposal (e.g. 'claude-code', 'xavier', 'sync-agent')."
    },
    "reviewer": {
      "type": ["string", "null"],
      "description": "Who reviewed this proposal. Populated at review time."
    },
    "decided_at": {
      "type": ["string", "null"],
      "format": "date-time",
      "description": "When the proposal was approved or rejected."
    },
    "decision_notes": {
      "type": ["string", "null"],
      "description": "Notes from the reviewer explaining the decision."
    }
  }
}
